85,https://doi.org/10.1080/01419870.2021.1900584,Are lighter-skinned Tanisha and Jamal worth more pay? White people’s gendered colorism toward Black job applicants with racialized names,Social Science,Ethnic and Racial Studies,Mar-21," Colorism, experiment,inequality,names,prejudice,racial discrimination",task,Mturk,433,431,411.35,
,,,,,,,task,Mturk,427,423,405.65,
86,https://doi-org.ezproxy.whitman.edu/10.1093/rfs/hhz131,Initial Coin Offerings: Financing Growth with Cryptocurrency Token Sales,Finance ,The Review of Financial Studies,Nov-19," Asset Pricing; Trading volume; Bond Interest Rates, Capital Budgeting; Fixed Investment and Inventory Studies; Capacity",Regression Prediction ,Twitter  ,,,,
87,https://doi-org.ezproxy.whitman.edu/10.1093/rfs/hhy050,Does It Pay to Pay Attention?,Finance ,The Review of Financial Studies,Dec-18,"  Household Saving; Personal Finance, Behavioral Finance: Underlying Principles, General,Portfolio Choice; Investment Decisions",Regression Prediction ,Google search ,Big data,,,
88, https://doi-org.ezproxy.whitman.edu/10.1093/rfs/hhab021,"Competing for Talent: Firms, Managers, and Social Networks",Finance ,The Review of Financial Studies,Feb-21," General,Human Capital; Skills; Occupational Choice; Labor Productivity,Personnel Management; Executives; Executive Compensation,Firm Employment Decisions; Promotions",Regression Prediction ,LinkedIn ,,2176,0,
89,https://doi-org.ezproxy.whitman.edu/10.1093/rfs/hhaa072,"Demand for Information, Uncertainty, and the Response of U.S. Treasury Securities to News",Finance ,The Review of Financial Studies,Jul-21,"Demand for Information, Uncertainty, and the Response of U.S. Treasury Securities to News",Regression Prediction ,Google search ,,,,
90,https://doi-org.ezproxy.whitman.edu/10.1093/rfs/hhaa085,How Do Consumers Fare When Dealing with Debt Collectors? Evidence from Out-of-Court Settlements,Finance ,The Review of Financial Studies,Apr-21," Household Saving; Personal Finance, Consumer Protection,Household Saving, Borrowing, Debt, and Wealth, Financial Literacy",Correlation ,Mturk ,3000,3000,,
91,https://doi-org.ezproxy.whitman.edu/10.1093/rfs/hhs071,Trust and Credit: The Role of Appearance in Peer-to-peer Lending,Psychology,The Review of Financial Studies,Aug-21,,"task, correlatiom",Mturk,25,25,,
92,https://doi-org.ezproxy.whitman.edu/10.1093/rfs/hhy111,Low Interest Rates and Risk-Taking: Evidence from Individual Investment Decisions,Finance ,The Review of Financial Studies,Jun-19,"Household Saving; Personal Finance,Financial Markets and the Macroeconomy, Monetary Policy, Portfolio Choice; Investment Decisions",,Mturk,,,,
,10.1257/jep.32.3.259,"Social Connectedness: Measurement, Determinants, and Effects",Economic ,The Journal of Economic Perspectives,Aug-18,,Social network analysis,Facebook ,Big data,,,